No.     Time           Source                Destination           Protocol Length Info
      1 0.000000       162.254.193.75        192.168.1.226         TLSv1.2  147    Application Data

Frame 1: 147 bytes on wire (1176 bits), 147 bytes captured (1176 bits) on interface \Device\NPF_{25627DC9-4B2C-438E-8836-0776256B76DB}, id 0
Ethernet II, Src: ASUSTekCOMPU_c3:1e:50 (70:8b:cd:c3:1e:50), Dst: Intel_3f:e0:b7 (58:1c:f8:3f:e0:b7)
Internet Protocol Version 4, Src: 162.254.193.75, Dst: 192.168.1.226
Transmission Control Protocol, Src Port: 27020, Dst Port: 65245, Seq: 1, Ack: 1, Len: 93
Transport Layer Security

No.     Time           Source                Destination           Protocol Length Info
      2 0.043488       192.168.1.226         162.254.193.75        TCP      54     65245 → 27020 [ACK] Seq=1 Ack=94 Win=507 Len=0

Frame 2: 54 bytes on wire (432 bits), 54 bytes captured (432 bits) on interface \Device\NPF_{25627DC9-4B2C-438E-8836-0776256B76DB}, id 0
Ethernet II, Src: Intel_3f:e0:b7 (58:1c:f8:3f:e0:b7), Dst: ASUSTekCOMPU_c3:1e:50 (70:8b:cd:c3:1e:50)
Internet Protocol Version 4, Src: 192.168.1.226, Dst: 162.254.193.75
Transmission Control Protocol, Src Port: 65245, Dst Port: 27020, Seq: 1, Ack: 94, Len: 0

No.     Time           Source                Destination           Protocol Length Info
      3 0.164891       192.168.1.226         18.238.59.12          TLSv1.2  93     Application Data

Frame 3: 93 bytes on wire (744 bits), 93 bytes captured (744 bits) on interface \Device\NPF_{25627DC9-4B2C-438E-8836-0776256B76DB}, id 0
Ethernet II, Src: Intel_3f:e0:b7 (58:1c:f8:3f:e0:b7), Dst: ASUSTekCOMPU_c3:1e:50 (70:8b:cd:c3:1e:50)
Internet Protocol Version 4, Src: 192.168.1.226, Dst: 18.238.59.12
Transmission Control Protocol, Src Port: 49788, Dst Port: 443, Seq: 1, Ack: 1, Len: 39
Transport Layer Security

No.     Time           Source                Destination           Protocol Length Info
      4 0.202233       18.238.59.12          192.168.1.226         TLSv1.2  93     Application Data

Frame 4: 93 bytes on wire (744 bits), 93 bytes captured (744 bits) on interface \Device\NPF_{25627DC9-4B2C-438E-8836-0776256B76DB}, id 0
Ethernet II, Src: ASUSTekCOMPU_c3:1e:50 (70:8b:cd:c3:1e:50), Dst: Intel_3f:e0:b7 (58:1c:f8:3f:e0:b7)
Internet Protocol Version 4, Src: 18.238.59.12, Dst: 192.168.1.226
Transmission Control Protocol, Src Port: 443, Dst Port: 49788, Seq: 1, Ack: 40, Len: 39
Transport Layer Security

No.     Time           Source                Destination           Protocol Length Info
      5 0.246691       192.168.1.226         18.238.59.12          TCP      54     49788 → 443 [ACK] Seq=40 Ack=40 Win=1032 Len=0

Frame 5: 54 bytes on wire (432 bits), 54 bytes captured (432 bits) on interface \Device\NPF_{25627DC9-4B2C-438E-8836-0776256B76DB}, id 0
Ethernet II, Src: Intel_3f:e0:b7 (58:1c:f8:3f:e0:b7), Dst: ASUSTekCOMPU_c3:1e:50 (70:8b:cd:c3:1e:50)
Internet Protocol Version 4, Src: 192.168.1.226, Dst: 18.238.59.12
Transmission Control Protocol, Src Port: 49788, Dst Port: 443, Seq: 40, Ack: 40, Len: 0

No.     Time           Source                Destination           Protocol Length Info
      6 1.744455       fe80::9a22:6eff:fec0:b8ed ff02::fb              MDNS     99     Standard query 0x0000 PTR _sengled._udp.local, "QM" question

Frame 6: 99 bytes on wire (792 bits), 99 bytes captured (792 bits) on interface \Device\NPF_{25627DC9-4B2C-438E-8836-0776256B76DB}, id 0
Ethernet II, Src: AmazonTechno_c0:b8:ed (98:22:6e:c0:b8:ed), Dst: IPv6mcast_fb (33:33:00:00:00:fb)
Internet Protocol Version 6, Src: fe80::9a22:6eff:fec0:b8ed, Dst: ff02::fb
User Datagram Protocol, Src Port: 5353, Dst Port: 5353
Multicast Domain Name System (query)

No.     Time           Source                Destination           Protocol Length Info
      7 1.744455       192.168.1.160         224.0.0.251           MDNS     79     Standard query 0x0000 PTR _sengled._udp.local, "QM" question

Frame 7: 79 bytes on wire (632 bits), 79 bytes captured (632 bits) on interface \Device\NPF_{25627DC9-4B2C-438E-8836-0776256B76DB}, id 0
Ethernet II, Src: AmazonTechno_c0:b8:ed (98:22:6e:c0:b8:ed), Dst: IPv4mcast_fb (01:00:5e:00:00:fb)
Internet Protocol Version 4, Src: 192.168.1.160, Dst: 224.0.0.251
User Datagram Protocol, Src Port: 5353, Dst Port: 5353
Multicast Domain Name System (query)

No.     Time           Source                Destination           Protocol Length Info
      8 1.967084       192.168.1.226         192.168.1.1           DNS      79     Standard query 0x3dc1 A excess.duolingo.com

Frame 8: 79 bytes on wire (632 bits), 79 bytes captured (632 bits) on interface \Device\NPF_{25627DC9-4B2C-438E-8836-0776256B76DB}, id 0
Ethernet II, Src: Intel_3f:e0:b7 (58:1c:f8:3f:e0:b7), Dst: ASUSTekCOMPU_c3:1e:50 (70:8b:cd:c3:1e:50)
Internet Protocol Version 4, Src: 192.168.1.226, Dst: 192.168.1.1
User Datagram Protocol, Src Port: 60219, Dst Port: 53
Domain Name System (query)

No.     Time           Source                Destination           Protocol Length Info
      9 1.968716       192.168.1.226         192.168.1.1           DNS      89     Standard query 0x2294 A d35aaqx5ub95lt.cloudfront.net

Frame 9: 89 bytes on wire (712 bits), 89 bytes captured (712 bits) on interface \Device\NPF_{25627DC9-4B2C-438E-8836-0776256B76DB}, id 0
Ethernet II, Src: Intel_3f:e0:b7 (58:1c:f8:3f:e0:b7), Dst: ASUSTekCOMPU_c3:1e:50 (70:8b:cd:c3:1e:50)
Internet Protocol Version 4, Src: 192.168.1.226, Dst: 192.168.1.1
User Datagram Protocol, Src Port: 54892, Dst Port: 53
Domain Name System (query)

No.     Time           Source                Destination           Protocol Length Info
     10 1.975359       192.168.1.226         34.231.226.121        TLSv1.2  151    Application Data

Frame 10: 151 bytes on wire (1208 bits), 151 bytes captured (1208 bits) on interface \Device\NPF_{25627DC9-4B2C-438E-8836-0776256B76DB}, id 0
Ethernet II, Src: Intel_3f:e0:b7 (58:1c:f8:3f:e0:b7), Dst: ASUSTekCOMPU_c3:1e:50 (70:8b:cd:c3:1e:50)
Internet Protocol Version 4, Src: 192.168.1.226, Dst: 34.231.226.121
Transmission Control Protocol, Src Port: 49501, Dst Port: 443, Seq: 1, Ack: 1, Len: 97
Transport Layer Security

No.     Time           Source                Destination           Protocol Length Info
     11 1.975418       192.168.1.226         34.231.226.121        TLSv1.2  1653   Application Data

Frame 11: 1653 bytes on wire (13224 bits), 1653 bytes captured (13224 bits) on interface \Device\NPF_{25627DC9-4B2C-438E-8836-0776256B76DB}, id 0
Ethernet II, Src: Intel_3f:e0:b7 (58:1c:f8:3f:e0:b7), Dst: ASUSTekCOMPU_c3:1e:50 (70:8b:cd:c3:1e:50)
Internet Protocol Version 4, Src: 192.168.1.226, Dst: 34.231.226.121
Transmission Control Protocol, Src Port: 49501, Dst Port: 443, Seq: 98, Ack: 1, Len: 1599
Transport Layer Security

No.     Time           Source                Destination           Protocol Length Info
     12 1.975467       192.168.1.226         34.231.226.121        TLSv1.2  345    Application Data

Frame 12: 345 bytes on wire (2760 bits), 345 bytes captured (2760 bits) on interface \Device\NPF_{25627DC9-4B2C-438E-8836-0776256B76DB}, id 0
Ethernet II, Src: Intel_3f:e0:b7 (58:1c:f8:3f:e0:b7), Dst: ASUSTekCOMPU_c3:1e:50 (70:8b:cd:c3:1e:50)
Internet Protocol Version 4, Src: 192.168.1.226, Dst: 34.231.226.121
Transmission Control Protocol, Src Port: 49501, Dst Port: 443, Seq: 1697, Ack: 1, Len: 291
Transport Layer Security

No.     Time           Source                Destination           Protocol Length Info
     13 1.982179       192.168.1.226         192.168.1.1           DNS      76     Standard query 0xc13e A www.duolingo.com

Frame 13: 76 bytes on wire (608 bits), 76 bytes captured (608 bits) on interface \Device\NPF_{25627DC9-4B2C-438E-8836-0776256B76DB}, id 0
Ethernet II, Src: Intel_3f:e0:b7 (58:1c:f8:3f:e0:b7), Dst: ASUSTekCOMPU_c3:1e:50 (70:8b:cd:c3:1e:50)
Internet Protocol Version 4, Src: 192.168.1.226, Dst: 192.168.1.1
User Datagram Protocol, Src Port: 57547, Dst Port: 53
Domain Name System (query)

No.     Time           Source                Destination           Protocol Length Info
     14 1.992164       192.168.1.226         34.196.112.235        TLSv1.2  2887   Application Data

Frame 14: 2887 bytes on wire (23096 bits), 2887 bytes captured (23096 bits) on interface \Device\NPF_{25627DC9-4B2C-438E-8836-0776256B76DB}, id 0
Ethernet II, Src: Intel_3f:e0:b7 (58:1c:f8:3f:e0:b7), Dst: ASUSTekCOMPU_c3:1e:50 (70:8b:cd:c3:1e:50)
Internet Protocol Version 4, Src: 192.168.1.226, Dst: 34.196.112.235
Transmission Control Protocol, Src Port: 49789, Dst Port: 443, Seq: 1, Ack: 1, Len: 2833
Transport Layer Security

No.     Time           Source                Destination           Protocol Length Info
     15 1.992236       192.168.1.226         34.196.112.235        TLSv1.2  16092  Application Data

Frame 15: 16092 bytes on wire (128736 bits), 16092 bytes captured (128736 bits) on interface \Device\NPF_{25627DC9-4B2C-438E-8836-0776256B76DB}, id 0
Ethernet II, Src: Intel_3f:e0:b7 (58:1c:f8:3f:e0:b7), Dst: ASUSTekCOMPU_c3:1e:50 (70:8b:cd:c3:1e:50)
Internet Protocol Version 4, Src: 192.168.1.226, Dst: 34.196.112.235
Transmission Control Protocol, Src Port: 49789, Dst Port: 443, Seq: 2834, Ack: 1, Len: 16038
Transport Layer Security

No.     Time           Source                Destination           Protocol Length Info
     16 1.992272       192.168.1.226         34.196.112.235        TLSv1.2  13081  Application Data

Frame 16: 13081 bytes on wire (104648 bits), 13081 bytes captured (104648 bits) on interface \Device\NPF_{25627DC9-4B2C-438E-8836-0776256B76DB}, id 0
Ethernet II, Src: Intel_3f:e0:b7 (58:1c:f8:3f:e0:b7), Dst: ASUSTekCOMPU_c3:1e:50 (70:8b:cd:c3:1e:50)
Internet Protocol Version 4, Src: 192.168.1.226, Dst: 34.196.112.235
Transmission Control Protocol, Src Port: 49789, Dst Port: 443, Seq: 18872, Ack: 1, Len: 13027
Transport Layer Security

No.     Time           Source                Destination           Protocol Length Info
     17 1.992312       192.168.1.226         34.196.112.235        TLSv1.2  1388   Application Data

Frame 17: 1388 bytes on wire (11104 bits), 1388 bytes captured (11104 bits) on interface \Device\NPF_{25627DC9-4B2C-438E-8836-0776256B76DB}, id 0
Ethernet II, Src: Intel_3f:e0:b7 (58:1c:f8:3f:e0:b7), Dst: ASUSTekCOMPU_c3:1e:50 (70:8b:cd:c3:1e:50)
Internet Protocol Version 4, Src: 192.168.1.226, Dst: 34.196.112.235
Transmission Control Protocol, Src Port: 49789, Dst Port: 443, Seq: 31899, Ack: 1, Len: 1334
Transport Layer Security

No.     Time           Source                Destination           Protocol Length Info
     18 1.992336       192.168.1.226         34.196.112.235        TLSv1.2  16092  Application Data

Frame 18: 16092 bytes on wire (128736 bits), 16092 bytes captured (128736 bits) on interface \Device\NPF_{25627DC9-4B2C-438E-8836-0776256B76DB}, id 0
Ethernet II, Src: Intel_3f:e0:b7 (58:1c:f8:3f:e0:b7), Dst: ASUSTekCOMPU_c3:1e:50 (70:8b:cd:c3:1e:50)
Internet Protocol Version 4, Src: 192.168.1.226, Dst: 34.196.112.235
Transmission Control Protocol, Src Port: 49789, Dst Port: 443, Seq: 33233, Ack: 1, Len: 16038
Transport Layer Security

No.     Time           Source                Destination           Protocol Length Info
     19 1.992363       192.168.1.226         34.196.112.235        TLSv1.2  15564  Application Data

Frame 19: 15564 bytes on wire (124512 bits), 15564 bytes captured (124512 bits) on interface \Device\NPF_{25627DC9-4B2C-438E-8836-0776256B76DB}, id 0
Ethernet II, Src: Intel_3f:e0:b7 (58:1c:f8:3f:e0:b7), Dst: ASUSTekCOMPU_c3:1e:50 (70:8b:cd:c3:1e:50)
Internet Protocol Version 4, Src: 192.168.1.226, Dst: 34.196.112.235
Transmission Control Protocol, Src Port: 49789, Dst Port: 443, Seq: 49271, Ack: 1, Len: 15510
Transport Layer Security

No.     Time           Source                Destination           Protocol Length Info
     20 1.992390       192.168.1.226         34.196.112.235        TLSv1.2  636    Application Data

Frame 20: 636 bytes on wire (5088 bits), 636 bytes captured (5088 bits) on interface \Device\NPF_{25627DC9-4B2C-438E-8836-0776256B76DB}, id 0
Ethernet II, Src: Intel_3f:e0:b7 (58:1c:f8:3f:e0:b7), Dst: ASUSTekCOMPU_c3:1e:50 (70:8b:cd:c3:1e:50)
Internet Protocol Version 4, Src: 192.168.1.226, Dst: 34.196.112.235
Transmission Control Protocol, Src Port: 49789, Dst Port: 443, Seq: 64781, Ack: 1, Len: 582
Transport Layer Security

No.     Time           Source                Destination           Protocol Length Info
     21 1.992403       192.168.1.226         34.196.112.235        TLSv1.2  3327   Application Data

Frame 21: 3327 bytes on wire (26616 bits), 3327 bytes captured (26616 bits) on interface \Device\NPF_{25627DC9-4B2C-438E-8836-0776256B76DB}, id 0
Ethernet II, Src: Intel_3f:e0:b7 (58:1c:f8:3f:e0:b7), Dst: ASUSTekCOMPU_c3:1e:50 (70:8b:cd:c3:1e:50)
Internet Protocol Version 4, Src: 192.168.1.226, Dst: 34.196.112.235
Transmission Control Protocol, Src Port: 49789, Dst Port: 443, Seq: 65363, Ack: 1, Len: 3273
Transport Layer Security

No.     Time           Source                Destination           Protocol Length Info
     22 1.995153       192.168.1.226         34.231.226.121        TLSv1.2  138    Application Data

Frame 22: 138 bytes on wire (1104 bits), 138 bytes captured (1104 bits) on interface \Device\NPF_{25627DC9-4B2C-438E-8836-0776256B76DB}, id 0
Ethernet II, Src: Intel_3f:e0:b7 (58:1c:f8:3f:e0:b7), Dst: ASUSTekCOMPU_c3:1e:50 (70:8b:cd:c3:1e:50)
Internet Protocol Version 4, Src: 192.168.1.226, Dst: 34.231.226.121
Transmission Control Protocol, Src Port: 49501, Dst Port: 443, Seq: 1988, Ack: 1, Len: 84
Transport Layer Security

No.     Time           Source                Destination           Protocol Length Info
     23 1.995203       192.168.1.226         34.231.226.121        TLSv1.2  1672   Application Data

Frame 23: 1672 bytes on wire (13376 bits), 1672 bytes captured (13376 bits) on interface \Device\NPF_{25627DC9-4B2C-438E-8836-0776256B76DB}, id 0
Ethernet II, Src: Intel_3f:e0:b7 (58:1c:f8:3f:e0:b7), Dst: ASUSTekCOMPU_c3:1e:50 (70:8b:cd:c3:1e:50)
Internet Protocol Version 4, Src: 192.168.1.226, Dst: 34.231.226.121
Transmission Control Protocol, Src Port: 49501, Dst Port: 443, Seq: 2072, Ack: 1, Len: 1618
Transport Layer Security

No.     Time           Source                Destination           Protocol Length Info
     24 1.995279       192.168.1.226         34.231.226.121        TLSv1.2  2374   Application Data

Frame 24: 2374 bytes on wire (18992 bits), 2374 bytes captured (18992 bits) on interface \Device\NPF_{25627DC9-4B2C-438E-8836-0776256B76DB}, id 0
Ethernet II, Src: Intel_3f:e0:b7 (58:1c:f8:3f:e0:b7), Dst: ASUSTekCOMPU_c3:1e:50 (70:8b:cd:c3:1e:50)
Internet Protocol Version 4, Src: 192.168.1.226, Dst: 34.231.226.121
Transmission Control Protocol, Src Port: 49501, Dst Port: 443, Seq: 3690, Ack: 1, Len: 2320
Transport Layer Security

No.     Time           Source                Destination           Protocol Length Info
     25 2.000128       192.168.1.1           192.168.1.226         DNS      207    Standard query response 0x3dc1 A excess.duolingo.com A 34.192.200.12 A 34.198.20.158 A 34.224.129.242 A 34.237.184.99 A 35.153.45.11 A 44.213.45.164 A 52.72.215.54 A 98.84.189.204

Frame 25: 207 bytes on wire (1656 bits), 207 bytes captured (1656 bits) on interface \Device\NPF_{25627DC9-4B2C-438E-8836-0776256B76DB}, id 0
Ethernet II, Src: ASUSTekCOMPU_c3:1e:50 (70:8b:cd:c3:1e:50), Dst: Intel_3f:e0:b7 (58:1c:f8:3f:e0:b7)
Internet Protocol Version 4, Src: 192.168.1.1, Dst: 192.168.1.226
User Datagram Protocol, Src Port: 53, Dst Port: 60219
Domain Name System (response)

No.     Time           Source                Destination           Protocol Length Info
     26 2.007730       192.168.1.226         192.168.1.1           DNS      89     Standard query 0x2294 A d35aaqx5ub95lt.cloudfront.net

Frame 26: 89 bytes on wire (712 bits), 89 bytes captured (712 bits) on interface \Device\NPF_{25627DC9-4B2C-438E-8836-0776256B76DB}, id 0
Ethernet II, Src: Intel_3f:e0:b7 (58:1c:f8:3f:e0:b7), Dst: ASUSTekCOMPU_c3:1e:50 (70:8b:cd:c3:1e:50)
Internet Protocol Version 4, Src: 192.168.1.226, Dst: 192.168.1.1
User Datagram Protocol, Src Port: 54892, Dst Port: 53
Domain Name System (query)

No.     Time           Source                Destination           Protocol Length Info
     27 2.011738       192.168.1.1           192.168.1.226         DNS      204    Standard query response 0xc13e A www.duolingo.com A 52.44.164.81 A 54.209.232.90 A 72.44.39.216 A 23.21.221.239 A 44.208.92.222 A 44.208.179.98 A 44.223.175.105 A 44.223.229.185

Frame 27: 204 bytes on wire (1632 bits), 204 bytes captured (1632 bits) on interface \Device\NPF_{25627DC9-4B2C-438E-8836-0776256B76DB}, id 0
Ethernet II, Src: ASUSTekCOMPU_c3:1e:50 (70:8b:cd:c3:1e:50), Dst: Intel_3f:e0:b7 (58:1c:f8:3f:e0:b7)
Internet Protocol Version 4, Src: 192.168.1.1, Dst: 192.168.1.226
User Datagram Protocol, Src Port: 53, Dst Port: 57547
Domain Name System (response)

No.     Time           Source                Destination           Protocol Length Info
     28 2.023384       34.231.226.121        192.168.1.226         TCP      60     443 → 49501 [ACK] Seq=1 Ack=1988 Win=806 Len=0

Frame 28: 60 bytes on wire (480 bits), 60 bytes captured (480 bits) on interface \Device\NPF_{25627DC9-4B2C-438E-8836-0776256B76DB}, id 0
Ethernet II, Src: ASUSTekCOMPU_c3:1e:50 (70:8b:cd:c3:1e:50), Dst: Intel_3f:e0:b7 (58:1c:f8:3f:e0:b7)
Internet Protocol Version 4, Src: 34.231.226.121, Dst: 192.168.1.226
Transmission Control Protocol, Src Port: 443, Dst Port: 49501, Seq: 1, Ack: 1988, Len: 0

No.     Time           Source                Destination           Protocol Length Info
     29 2.041741       34.196.112.235        192.168.1.226         TCP      66     443 → 49789 [ACK] Seq=1 Ack=1461 Win=2837 Len=0 SLE=5754 SRE=8674

Frame 29: 66 bytes on wire (528 bits), 66 bytes captured (528 bits) on interface \Device\NPF_{25627DC9-4B2C-438E-8836-0776256B76DB}, id 0
Ethernet II, Src: ASUSTekCOMPU_c3:1e:50 (70:8b:cd:c3:1e:50), Dst: Intel_3f:e0:b7 (58:1c:f8:3f:e0:b7)
Internet Protocol Version 4, Src: 34.196.112.235, Dst: 192.168.1.226
Transmission Control Protocol, Src Port: 443, Dst Port: 49789, Seq: 1, Ack: 1461, Len: 0

No.     Time           Source                Destination           Protocol Length Info
     30 2.041741       34.196.112.235        192.168.1.226         TCP      66     [TCP Dup ACK 29#1] 443 → 49789 [ACK] Seq=1 Ack=1461 Win=2837 Len=0 SLE=5754 SRE=11594

Frame 30: 66 bytes on wire (528 bits), 66 bytes captured (528 bits) on interface \Device\NPF_{25627DC9-4B2C-438E-8836-0776256B76DB}, id 0
Ethernet II, Src: ASUSTekCOMPU_c3:1e:50 (70:8b:cd:c3:1e:50), Dst: Intel_3f:e0:b7 (58:1c:f8:3f:e0:b7)
Internet Protocol Version 4, Src: 34.196.112.235, Dst: 192.168.1.226
Transmission Control Protocol, Src Port: 443, Dst Port: 49789, Seq: 1, Ack: 1461, Len: 0

No.     Time           Source                Destination           Protocol Length Info
     31 2.041741       34.196.112.235        192.168.1.226         TCP      66     [TCP Dup ACK 29#2] 443 → 49789 [ACK] Seq=1 Ack=1461 Win=2837 Len=0 SLE=5754 SRE=13054

Frame 31: 66 bytes on wire (528 bits), 66 bytes captured (528 bits) on interface \Device\NPF_{25627DC9-4B2C-438E-8836-0776256B76DB}, id 0
Ethernet II, Src: ASUSTekCOMPU_c3:1e:50 (70:8b:cd:c3:1e:50), Dst: Intel_3f:e0:b7 (58:1c:f8:3f:e0:b7)
Internet Protocol Version 4, Src: 34.196.112.235, Dst: 192.168.1.226
Transmission Control Protocol, Src Port: 443, Dst Port: 49789, Seq: 1, Ack: 1461, Len: 0

No.     Time           Source                Destination           Protocol Length Info
     32 2.041889       34.196.112.235        192.168.1.226         TCP      66     [TCP Dup ACK 29#3] 443 → 49789 [ACK] Seq=1 Ack=1461 Win=2837 Len=0 SLE=5754 SRE=14514

Frame 32: 66 bytes on wire (528 bits), 66 bytes captured (528 bits) on interface \Device\NPF_{25627DC9-4B2C-438E-8836-0776256B76DB}, id 0
Ethernet II, Src: ASUSTekCOMPU_c3:1e:50 (70:8b:cd:c3:1e:50), Dst: Intel_3f:e0:b7 (58:1c:f8:3f:e0:b7)
Internet Protocol Version 4, Src: 34.196.112.235, Dst: 192.168.1.226
Transmission Control Protocol, Src Port: 443, Dst Port: 49789, Seq: 1, Ack: 1461, Len: 0

No.     Time           Source                Destination           Protocol Length Info
     33 2.041889       34.196.112.235        192.168.1.226         TCP      66     [TCP Dup ACK 29#4] 443 → 49789 [ACK] Seq=1 Ack=1461 Win=2837 Len=0 SLE=5754 SRE=17434

Frame 33: 66 bytes on wire (528 bits), 66 bytes captured (528 bits) on interface \Device\NPF_{25627DC9-4B2C-438E-8836-0776256B76DB}, id 0
Ethernet II, Src: ASUSTekCOMPU_c3:1e:50 (70:8b:cd:c3:1e:50), Dst: Intel_3f:e0:b7 (58:1c:f8:3f:e0:b7)
Internet Protocol Version 4, Src: 34.196.112.235, Dst: 192.168.1.226
Transmission Control Protocol, Src Port: 443, Dst Port: 49789, Seq: 1, Ack: 1461, Len: 0

No.     Time           Source                Destination           Protocol Length Info
     34 2.041889       34.196.112.235        192.168.1.226         TCP      66     [TCP Dup ACK 29#5] 443 → 49789 [ACK] Seq=1 Ack=1461 Win=2837 Len=0 SLE=5754 SRE=18872

Frame 34: 66 bytes on wire (528 bits), 66 bytes captured (528 bits) on interface \Device\NPF_{25627DC9-4B2C-438E-8836-0776256B76DB}, id 0
Ethernet II, Src: ASUSTekCOMPU_c3:1e:50 (70:8b:cd:c3:1e:50), Dst: Intel_3f:e0:b7 (58:1c:f8:3f:e0:b7)
Internet Protocol Version 4, Src: 34.196.112.235, Dst: 192.168.1.226
Transmission Control Protocol, Src Port: 443, Dst Port: 49789, Seq: 1, Ack: 1461, Len: 0

No.     Time           Source                Destination           Protocol Length Info
     35 2.041889       34.196.112.235        192.168.1.226         TCP      66     [TCP Dup ACK 29#6] 443 → 49789 [ACK] Seq=1 Ack=1461 Win=2837 Len=0 SLE=5754 SRE=21792

Frame 35: 66 bytes on wire (528 bits), 66 bytes captured (528 bits) on interface \Device\NPF_{25627DC9-4B2C-438E-8836-0776256B76DB}, id 0
Ethernet II, Src: ASUSTekCOMPU_c3:1e:50 (70:8b:cd:c3:1e:50), Dst: Intel_3f:e0:b7 (58:1c:f8:3f:e0:b7)
Internet Protocol Version 4, Src: 34.196.112.235, Dst: 192.168.1.226
Transmission Control Protocol, Src Port: 443, Dst Port: 49789, Seq: 1, Ack: 1461, Len: 0

No.     Time           Source                Destination           Protocol Length Info
     36 2.041889       34.196.112.235        192.168.1.226         TCP      66     [TCP Dup ACK 29#7] 443 → 49789 [ACK] Seq=1 Ack=1461 Win=2837 Len=0 SLE=5754 SRE=23252

Frame 36: 66 bytes on wire (528 bits), 66 bytes captured (528 bits) on interface \Device\NPF_{25627DC9-4B2C-438E-8836-0776256B76DB}, id 0
Ethernet II, Src: ASUSTekCOMPU_c3:1e:50 (70:8b:cd:c3:1e:50), Dst: Intel_3f:e0:b7 (58:1c:f8:3f:e0:b7)
Internet Protocol Version 4, Src: 34.196.112.235, Dst: 192.168.1.226
Transmission Control Protocol, Src Port: 443, Dst Port: 49789, Seq: 1, Ack: 1461, Len: 0

No.     Time           Source                Destination           Protocol Length Info
     37 2.041899       192.168.1.226         34.196.112.235        TLSv1.2  1514   [TCP Fast Retransmission] , Ignored Unknown Record

Frame 37: 1514 bytes on wire (12112 bits), 1514 bytes captured (12112 bits) on interface \Device\NPF_{25627DC9-4B2C-438E-8836-0776256B76DB}, id 0
Ethernet II, Src: Intel_3f:e0:b7 (58:1c:f8:3f:e0:b7), Dst: ASUSTekCOMPU_c3:1e:50 (70:8b:cd:c3:1e:50)
Internet Protocol Version 4, Src: 192.168.1.226, Dst: 34.196.112.235
Transmission Control Protocol, Src Port: 49789, Dst Port: 443, Seq: 1461, Ack: 1, Len: 1460
Transport Layer Security

No.     Time           Source                Destination           Protocol Length Info
     38 2.041932       192.168.1.226         34.196.112.235        TLSv1.2  1514   [TCP Fast Retransmission] , Ignored Unknown Record

Frame 38: 1514 bytes on wire (12112 bits), 1514 bytes captured (12112 bits) on interface \Device\NPF_{25627DC9-4B2C-438E-8836-0776256B76DB}, id 0
Ethernet II, Src: Intel_3f:e0:b7 (58:1c:f8:3f:e0:b7), Dst: ASUSTekCOMPU_c3:1e:50 (70:8b:cd:c3:1e:50)
Internet Protocol Version 4, Src: 192.168.1.226, Dst: 34.196.112.235
Transmission Control Protocol, Src Port: 49789, Dst Port: 443, Seq: 2921, Ack: 1, Len: 1460
Transport Layer Security

No.     Time           Source                Destination           Protocol Length Info
     39 2.041932       192.168.1.226         34.196.112.235        TLSv1.2  1427   [TCP Fast Retransmission] , Ignored Unknown Record

Frame 39: 1427 bytes on wire (11416 bits), 1427 bytes captured (11416 bits) on interface \Device\NPF_{25627DC9-4B2C-438E-8836-0776256B76DB}, id 0
Ethernet II, Src: Intel_3f:e0:b7 (58:1c:f8:3f:e0:b7), Dst: ASUSTekCOMPU_c3:1e:50 (70:8b:cd:c3:1e:50)
Internet Protocol Version 4, Src: 192.168.1.226, Dst: 34.196.112.235
Transmission Control Protocol, Src Port: 49789, Dst Port: 443, Seq: 4381, Ack: 1, Len: 1373
Transport Layer Security

No.     Time           Source                Destination           Protocol Length Info
     40 2.044973       34.196.112.235        192.168.1.226         TCP      66     [TCP Dup ACK 29#8] 443 → 49789 [ACK] Seq=1 Ack=1461 Win=2837 Len=0 SLE=5754 SRE=24712

Frame 40: 66 bytes on wire (528 bits), 66 bytes captured (528 bits) on interface \Device\NPF_{25627DC9-4B2C-438E-8836-0776256B76DB}, id 0
Ethernet II, Src: ASUSTekCOMPU_c3:1e:50 (70:8b:cd:c3:1e:50), Dst: Intel_3f:e0:b7 (58:1c:f8:3f:e0:b7)
Internet Protocol Version 4, Src: 34.196.112.235, Dst: 192.168.1.226
Transmission Control Protocol, Src Port: 443, Dst Port: 49789, Seq: 1, Ack: 1461, Len: 0

No.     Time           Source                Destination           Protocol Length Info
     41 2.044973       34.196.112.235        192.168.1.226         TCP      66     [TCP Dup ACK 29#9] 443 → 49789 [ACK] Seq=1 Ack=1461 Win=2837 Len=0 SLE=5754 SRE=26172

Frame 41: 66 bytes on wire (528 bits), 66 bytes captured (528 bits) on interface \Device\NPF_{25627DC9-4B2C-438E-8836-0776256B76DB}, id 0
Ethernet II, Src: ASUSTekCOMPU_c3:1e:50 (70:8b:cd:c3:1e:50), Dst: Intel_3f:e0:b7 (58:1c:f8:3f:e0:b7)
Internet Protocol Version 4, Src: 34.196.112.235, Dst: 192.168.1.226
Transmission Control Protocol, Src Port: 443, Dst Port: 49789, Seq: 1, Ack: 1461, Len: 0

No.     Time           Source                Destination           Protocol Length Info
     42 2.047826       34.196.112.235        192.168.1.226         TCP      66     [TCP Dup ACK 29#10] 443 → 49789 [ACK] Seq=1 Ack=1461 Win=2837 Len=0 SLE=5754 SRE=29092

Frame 42: 66 bytes on wire (528 bits), 66 bytes captured (528 bits) on interface \Device\NPF_{25627DC9-4B2C-438E-8836-0776256B76DB}, id 0
Ethernet II, Src: ASUSTekCOMPU_c3:1e:50 (70:8b:cd:c3:1e:50), Dst: Intel_3f:e0:b7 (58:1c:f8:3f:e0:b7)
Internet Protocol Version 4, Src: 34.196.112.235, Dst: 192.168.1.226
Transmission Control Protocol, Src Port: 443, Dst Port: 49789, Seq: 1, Ack: 1461, Len: 0

No.     Time           Source                Destination           Protocol Length Info
     43 2.047918       34.196.112.235        192.168.1.226         TCP      66     [TCP Dup ACK 29#11] 443 → 49789 [ACK] Seq=1 Ack=1461 Win=2837 Len=0 SLE=5754 SRE=31899

Frame 43: 66 bytes on wire (528 bits), 66 bytes captured (528 bits) on interface \Device\NPF_{25627DC9-4B2C-438E-8836-0776256B76DB}, id 0
Ethernet II, Src: ASUSTekCOMPU_c3:1e:50 (70:8b:cd:c3:1e:50), Dst: Intel_3f:e0:b7 (58:1c:f8:3f:e0:b7)
Internet Protocol Version 4, Src: 34.196.112.235, Dst: 192.168.1.226
Transmission Control Protocol, Src Port: 443, Dst Port: 49789, Seq: 1, Ack: 1461, Len: 0

No.     Time           Source                Destination           Protocol Length Info
     44 2.048058       34.196.112.235        192.168.1.226         TCP      66     [TCP Dup ACK 29#12] 443 → 49789 [ACK] Seq=1 Ack=1461 Win=2837 Len=0 SLE=5754 SRE=33233

Frame 44: 66 bytes on wire (528 bits), 66 bytes captured (528 bits) on interface \Device\NPF_{25627DC9-4B2C-438E-8836-0776256B76DB}, id 0
Ethernet II, Src: ASUSTekCOMPU_c3:1e:50 (70:8b:cd:c3:1e:50), Dst: Intel_3f:e0:b7 (58:1c:f8:3f:e0:b7)
Internet Protocol Version 4, Src: 34.196.112.235, Dst: 192.168.1.226
Transmission Control Protocol, Src Port: 443, Dst Port: 49789, Seq: 1, Ack: 1461, Len: 0

No.     Time           Source                Destination           Protocol Length Info
     45 2.048058       34.196.112.235        192.168.1.226         TCP      66     [TCP Dup ACK 29#13] 443 → 49789 [ACK] Seq=1 Ack=1461 Win=2837 Len=0 SLE=5754 SRE=36153

Frame 45: 66 bytes on wire (528 bits), 66 bytes captured (528 bits) on interface \Device\NPF_{25627DC9-4B2C-438E-8836-0776256B76DB}, id 0
Ethernet II, Src: ASUSTekCOMPU_c3:1e:50 (70:8b:cd:c3:1e:50), Dst: Intel_3f:e0:b7 (58:1c:f8:3f:e0:b7)
Internet Protocol Version 4, Src: 34.196.112.235, Dst: 192.168.1.226
Transmission Control Protocol, Src Port: 443, Dst Port: 49789, Seq: 1, Ack: 1461, Len: 0

No.     Time           Source                Destination           Protocol Length Info
     46 2.048058       34.196.112.235        192.168.1.226         TCP      74     [TCP Dup ACK 29#14] 443 → 49789 [ACK] Seq=1 Ack=1461 Win=2837 Len=0 SLE=50731 SRE=52191 SLE=5754 SRE=36153

Frame 46: 74 bytes on wire (592 bits), 74 bytes captured (592 bits) on interface \Device\NPF_{25627DC9-4B2C-438E-8836-0776256B76DB}, id 0
Ethernet II, Src: ASUSTekCOMPU_c3:1e:50 (70:8b:cd:c3:1e:50), Dst: Intel_3f:e0:b7 (58:1c:f8:3f:e0:b7)
Internet Protocol Version 4, Src: 34.196.112.235, Dst: 192.168.1.226
Transmission Control Protocol, Src Port: 443, Dst Port: 49789, Seq: 1, Ack: 1461, Len: 0

No.     Time           Source                Destination           Protocol Length Info
     47 2.048058       34.196.112.235        192.168.1.226         TCP      74     [TCP Dup ACK 29#15] 443 → 49789 [ACK] Seq=1 Ack=1461 Win=2837 Len=0 SLE=5754 SRE=37613 SLE=50731 SRE=52191

Frame 47: 74 bytes on wire (592 bits), 74 bytes captured (592 bits) on interface \Device\NPF_{25627DC9-4B2C-438E-8836-0776256B76DB}, id 0
Ethernet II, Src: ASUSTekCOMPU_c3:1e:50 (70:8b:cd:c3:1e:50), Dst: Intel_3f:e0:b7 (58:1c:f8:3f:e0:b7)
Internet Protocol Version 4, Src: 34.196.112.235, Dst: 192.168.1.226
Transmission Control Protocol, Src Port: 443, Dst Port: 49789, Seq: 1, Ack: 1461, Len: 0

No.     Time           Source                Destination           Protocol Length Info
     48 2.048075       192.168.1.226         34.196.112.235        TLSv1.2  1514   [TCP Fast Retransmission] , Ignored Unknown Record

Frame 48: 1514 bytes on wire (12112 bits), 1514 bytes captured (12112 bits) on interface \Device\NPF_{25627DC9-4B2C-438E-8836-0776256B76DB}, id 0
Ethernet II, Src: Intel_3f:e0:b7 (58:1c:f8:3f:e0:b7), Dst: ASUSTekCOMPU_c3:1e:50 (70:8b:cd:c3:1e:50)
Internet Protocol Version 4, Src: 192.168.1.226, Dst: 34.196.112.235
Transmission Control Protocol, Src Port: 49789, Dst Port: 443, Seq: 36153, Ack: 1, Len: 1460
Transport Layer Security

No.     Time           Source                Destination           Protocol Length Info
     49 2.048075       192.168.1.226         34.196.112.235        TLSv1.2  1514   [TCP Fast Retransmission] , Ignored Unknown Record

Frame 49: 1514 bytes on wire (12112 bits), 1514 bytes captured (12112 bits) on interface \Device\NPF_{25627DC9-4B2C-438E-8836-0776256B76DB}, id 0
Ethernet II, Src: Intel_3f:e0:b7 (58:1c:f8:3f:e0:b7), Dst: ASUSTekCOMPU_c3:1e:50 (70:8b:cd:c3:1e:50)
Internet Protocol Version 4, Src: 192.168.1.226, Dst: 34.196.112.235
Transmission Control Protocol, Src Port: 49789, Dst Port: 443, Seq: 37613, Ack: 1, Len: 1460
Transport Layer Security

No.     Time           Source                Destination           Protocol Length Info
     50 2.048075       192.168.1.226         34.196.112.235        TLSv1.2  1514   [TCP Fast Retransmission] , Ignored Unknown Record

Frame 50: 1514 bytes on wire (12112 bits), 1514 bytes captured (12112 bits) on interface \Device\NPF_{25627DC9-4B2C-438E-8836-0776256B76DB}, id 0
Ethernet II, Src: Intel_3f:e0:b7 (58:1c:f8:3f:e0:b7), Dst: ASUSTekCOMPU_c3:1e:50 (70:8b:cd:c3:1e:50)
Internet Protocol Version 4, Src: 192.168.1.226, Dst: 34.196.112.235
Transmission Control Protocol, Src Port: 49789, Dst Port: 443, Seq: 39073, Ack: 1, Len: 1460
Transport Layer Security

No.     Time           Source                Destination           Protocol Length Info
     51 2.048075       192.168.1.226         34.196.112.235        TCP      1514   [TCP Fast Retransmission] 49789 → 443 [ACK] Seq=40533 Ack=1 Win=512 Len=1460

Frame 51: 1514 bytes on wire (12112 bits), 1514 bytes captured (12112 bits) on interface \Device\NPF_{25627DC9-4B2C-438E-8836-0776256B76DB}, id 0
Ethernet II, Src: Intel_3f:e0:b7 (58:1c:f8:3f:e0:b7), Dst: ASUSTekCOMPU_c3:1e:50 (70:8b:cd:c3:1e:50)
Internet Protocol Version 4, Src: 192.168.1.226, Dst: 34.196.112.235
Transmission Control Protocol, Src Port: 49789, Dst Port: 443, Seq: 40533, Ack: 1, Len: 1460
Data (1460 bytes)

0000  30 23 38 74 70 62 c3 44 12 6e 5d c9 4a 31 19 af   0#8tpb.D.n].J1..
0010  91 c2 b9 a3 27 b8 58 75 e9 d1 6f 04 ca 4c a2 3f   ....'.Xu..o..L.?
0020  37 6a f0 11 be 7f 4b f4 37 a9 b9 5e 8e 2b e8 5d   7j....K.7..^.+.]
0030  11 1f 1a 5e b0 84 4a 1d fb fa 10 61 8b 43 90 fe   ...^..J....a.C..
0040  fc fe 72 99 32 42 f9 e6 64 9f 46 3c 44 18 39 99   ..r.2B..d.F<D.9.
0050  47 d6 49 ab 90 ab 04 75 25 d2 78 f0 72 1f 7f 3a   G.I....u%.x.r..:
0060  59 2e 77 90 7c d8 9f 6c 2e e4 d3 9f c2 f7 dd 45   Y.w.|..l.......E
0070  a5 a9 b2 a4 04 28 d5 04 ae 60 fe a4 40 5e 3d cf   .....(...`..@^=.
0080  37 5e c3 61 05 a3 ab 1a ba 43 73 c8 05 fa dd 30   7^.a.....Cs....0
0090  10 db 52 21 7e a4 61 40 b7 33 5d 97 f8 b8 74 96   ..R!~.a@.3]...t.
00a0  4c bd d9 68 0c 0b 20 3a 62 ee f4 21 a1 e1 6c dc   L..h.. :b..!..l.
00b0  46 9b f9 f6 e9 da d9 19 4b ba 05 33 52 e7 5f 98   F.......K..3R._.
00c0  ea 8e 27 84 bb ad 69 cf 8b ce 73 48 53 0b ff cd   ..'...i...sHS...
00d0  f8 3d 65 d6 e1 e8 38 d2 09 32 df e6 d8 54 ed ed   .=e...8..2...T..
00e0  3e 8c 72 83 fe 65 de 44 a1 bb e4 09 32 d3 ea a9   >.r..e.D....2...
00f0  d7 03 cb 13 8b 48 25 85 e8 44 91 61 4e 66 73 59   .....H%..D.aNfsY
0100  1c 5b d5 62 65 d1 10 ea ef ba bc 9b 91 7d 07 7c   .[.be........}.|
0110  d0 b2 61 2b 09 25 fa 7b af fd c5 9f 13 f2 27 5a   ..a+.%.{......'Z
0120  30 54 8d 20 f7 d6 f8 db 27 ee 2f 4e 79 f3 ba 3d   0T. ....'./Ny..=
0130  7b 1b 4c 34 cd 82 25 65 c7 45 c8 9e 58 8c a8 e5   {.L4..%e.E..X...
0140  40 12 ef 14 65 55 72 69 4b 4d 13 00 aa 7e 39 5f   @...eUriKM...~9_
0150  e1 01 fc 1d c0 76 67 f9 36 89 02 45 84 b3 99 6c   .....vg.6..E...l
0160  f0 a3 bc c8 96 09 e8 23 38 f1 34 3d 4f c9 e6 97   .......#8.4=O...
0170  2a 15 54 9d 60 56 bd ae ec dd 64 52 56 6c ed d9   *.T.`V....dRVl..
0180  34 5b 24 af 43 e7 3d 92 1c d8 3f 71 8e f6 e5 47   4[$.C.=...?q...G
0190  0b 19 75 30 52 a4 94 73 28 88 c2 b5 67 d5 12 e8   ..u0R..s(...g...
01a0  b6 c8 a4 ac 1a 1b 0d d4 bc 2d 02 7f 06 0c 6e 38   .........-....n8
01b0  9c 49 05 68 bb ab 7e a5 67 6c ce 08 1c a4 42 43   .I.h..~.gl....BC
01c0  7e aa 95 3c a2 ba f3 7d cb 99 bf 24 6a 7c cb 4f   ~..<...}...$j|.O
01d0  1a 43 1c b5 31 65 b3 f1 5c 34 67 ac 7f 39 f7 c0   .C..1e..\4g..9..
01e0  a8 7d de 1b 98 4d 26 b7 e5 6c 8a 41 84 e8 26 07   .}...M&..l.A..&.
01f0  1b 08 4c 2b c0 34 e2 db 9f af 2e 55 4b 3f 63 a9   ..L+.4.....UK?c.
0200  4f c3 51 81 7a c6 c5 3e f0 26 ed 39 b7 5b 10 af   O.Q.z..>.&.9.[..
0210  3f 51 14 21 93 70 4a 60 d0 4e f5 f9 32 3e b0 39   ?Q.!.pJ`.N..2>.9
0220  4d 6e 0e 08 c4 6e 8a cf 13 4c 41 eb 89 2b 69 b1   Mn...n...LA..+i.
0230  32 0f 8c 2e 29 65 a1 f3 b5 ae ec f3 3a 38 dc 55   2...)e......:8.U
0240  3d 74 5f 1f 5c 6c 9c 0c 8f c7 3d 1b 02 d8 03 12   =t_.\l....=.....
0250  7b a3 d3 00 18 ff 00 a1 4f fc 06 59 93 d8 26 11   {.......O..Y..&.
0260  ce 53 4a ca 7c 5c c9 29 39 0e 15 f1 c6 67 9b 97   .SJ.|\.)9....g..
0270  79 97 64 ff 88 a1 3b 7c b3 7d 71 33 51 d9 36 58   y.d...;|.}q3Q.6X
0280  bb 50 14 c3 ea 12 7a 3f 31 61 38 4d bc a8 96 38   .P....z?1a8M...8
0290  ea 5f de 09 d1 36 94 51 57 86 d6 24 01 a3 e8 12   ._...6.QW..$....
02a0  0e 18 7c bb 3c 9b 81 d9 b8 4f c1 bb ad 6c 65 12   ..|.<....O...le.
02b0  6d 8b 28 90 59 f1 78 7a 1d fe 48 c7 f4 df 7e 78   m.(.Y.xz..H...~x
02c0  46 0e 98 d7 71 87 f7 63 c8 1d 16 4b 51 37 e1 df   F...q..c...KQ7..
02d0  40 3d 81 95 b0 f8 a4 50 50 05 f1 69 ad 52 77 3f   @=.....PP..i.Rw?
02e0  28 1a f8 eb d8 0a c7 c4 f0 8a e7 b7 31 d4 24 e6   (...........1.$.
02f0  01 ee 9e 19 40 69 11 ba b6 ae ba 1f 0f f2 d9 e1   ....@i..........
0300  81 45 65 16 7a 87 bb b7 33 bd 5c 8f c8 be 8b 20   .Ee.z...3.\.... 
0310  25 1f 1c 82 04 66 b8 6c e0 da 64 2c ba 16 9f a0   %....f.l..d,....
0320  ef b8 51 61 77 e8 33 51 67 53 1e 0b 2a 93 eb 4a   ..Qaw.3QgS..*..J
0330  4c 09 cd e2 11 e3 f6 8d d0 98 9d 47 ed 8f 10 f3   L..........G....
0340  61 cb cc 50 b0 d2 8c 4e 1f 6d aa 81 44 3e 68 09   a..P...N.m..D>h.
0350  06 6f dd d4 b7 a6 bb 3b 3a 03 f1 3b 21 79 a9 05   .o.....;:..;!y..
0360  d6 03 58 77 1c b9 36 ed d5 98 12 e0 99 c2 b1 28   ..Xw..6........(
0370  b7 00 fd f9 11 44 b4 20 18 f4 67 9d a6 27 99 1a   .....D. ..g..'..
0380  6d b5 cf b4 46 8c 9f ef 20 58 7c 89 70 5a 07 30   m...F... X|.pZ.0
0390  11 eb 96 b5 04 ac 67 66 b5 31 5c 64 d9 9b be c1   ......gf.1\d....
03a0  f5 19 41 2f 4c 84 b1 a3 2d b0 5d 1d 38 98 e6 9b   ..A/L...-.].8...
03b0  ee fd c1 64 c5 81 a8 c5 ca bb 6c c1 f5 89 58 51   ...d......l...XQ
03c0  ab fb fd cc c3 96 5d 9e 27 59 98 a1 aa 83 a4 fe   ......].'Y......
03d0  1c f6 f9 5b 59 16 7e 8b 5f 50 8b 7b 50 4e 4e 16   ...[Y.~._P.{PNN.
03e0  2e 8a c5 8f 47 e5 db c7 a6 f7 a2 2d cb 94 db 5d   ....G......-...]
03f0  52 0d c2 d3 df a2 83 d5 96 00 16 92 45 9a e2 2e   R...........E...
0400  ca 33 f7 28 30 80 60 29 2e 44 c3 a3 c5 bc 5a 94   .3.(0.`).D....Z.
0410  be f7 dc 2f 83 bb c7 d2 ec 46 aa 1a 26 54 f7 4f   .../.....F..&T.O
0420  fb 45 d5 03 cd c9 b9 39 e0 b0 9d e7 eb 25 6f eb   .E.....9.....%o.
0430  1c af ff 33 9e bc 7a 1c 0a e4 4a af 6a ed 75 e3   ...3..z...J.j.u.
0440  14 7e 2d b2 bd 32 14 e8 07 ce ad 0e 6b 5f f3 17   .~-..2......k_..
0450  c9 c8 32 4f df 81 48 75 37 78 14 56 7d a2 fc 53   ..2O..Hu7x.V}..S
0460  0d 6b c5 a1 31 35 21 83 d9 f6 0a ea 65 72 6a 70   .k..15!.....erjp
0470  36 c7 51 4f b5 9e 9a 9e eb 94 5c 06 24 e2 e1 91   6.QO......\.$...
0480  88 d3 af fe 94 d5 6e 80 fa f2 95 b2 e9 08 83 2b   ......n........+
0490  a1 e8 ce 7b 5b c0 26 a4 e8 28 df 8c 2d d7 86 bb   ...{[.&..(..-...
04a0  6f 19 cc fe 60 98 a7 43 bd c7 82 f1 d6 7e a4 5f   o...`..C.....~._
04b0  e7 e9 97 cb c6 0e 6c 69 f8 da 21 1f a7 e2 48 65   ......li..!...He
04c0  98 3e 8a 31 c7 2c b9 ad 33 e1 0d d7 77 cd 7e d4   .>.1.,..3...w.~.
04d0  07 17 30 99 3a 09 98 96 76 52 c4 ab bf 6d f0 66   ..0.:...vR...m.f
04e0  2d f3 46 c3 b8 00 7f 8d ca d2 ed fa 3d c0 86 24   -.F.........=..$
04f0  79 2e ec c2 93 78 a1 02 69 5b b6 c1 6f d7 5c 02   y....x..i[..o.\.
0500  55 eb 66 43 d1 f7 bf 64 a4 15 e4 82 19 2e b3 fd   U.fC...d........
0510  a2 bf bf 07 76 f0 1e ef c6 e8 ac 4f 40 bd b5 b2   ....v......O@...
0520  d3 f8 41 48 6e 2d 36 bc 60 4e 73 6d f9 2f 25 ba   ..AHn-6.`Nsm./%.
0530  25 4d fa 9f 5f ca 73 80 49 a0 c1 9f 7c b6 d4 ed   %M.._.s.I...|...
0540  f1 84 c9 f0 dc bc a6 f9 f0 48 4b 45 33 de e1 88   .........HKE3...
0550  7a 90 a7 f8 61 f8 4f 95 1a e2 58 e5 07 e4 db c1   z...a.O...X.....
0560  6c b1 2a d4 48 b2 78 60 b6 c8 a9 45 b0 f5 67 ae   l.*.H.x`...E..g.
0570  a8 b3 b3 32 7c 16 a0 a5 fd fd f2 2f 88 eb 2f a5   ...2|....../../.
0580  dc e4 03 1a 67 03 9d 14 41 2a ba 41 e8 89 69 fb   ....g...A*.A..i.
0590  90 11 cd cd 9d e6 64 1d dd 54 94 ae 39 8d 05 ea   ......d..T..9...
05a0  1c 27 eb 27 09 99 59 af d8 f8 a6 5d b1 3e ea cc   .'.'..Y....].>..
05b0  10 57 c1 de                                       .W..

No.     Time           Source                Destination           Protocol Length Info
     52 2.048075       192.168.1.226         34.196.112.235        TLSv1.2  1514   [TCP Fast Retransmission] , Ignored Unknown Record

Frame 52: 1514 bytes on wire (12112 bits), 1514 bytes captured (12112 bits) on interface \Device\NPF_{25627DC9-4B2C-438E-8836-0776256B76DB}, id 0
Ethernet II, Src: Intel_3f:e0:b7 (58:1c:f8:3f:e0:b7), Dst: ASUSTekCOMPU_c3:1e:50 (70:8b:cd:c3:1e:50)
Internet Protocol Version 4, Src: 192.168.1.226, Dst: 34.196.112.235
